{
  "specialist": {
    "name": "wicked-qe",
    "role": "quality-engineering",
    "description": "Quality Engineering specialist for test strategy, scenario generation, test automation, and shift-left quality practices."
  },
  "personas": [
    {
      "name": "Test Strategist",
      "focus": "Test scenario generation, coverage strategy, risk-based prioritization",
      "agent": "agents/test-strategist.md"
    },
    {
      "name": "Test Automation Engineer",
      "focus": "Test code generation, CI/CD test integration, coverage reporting",
      "agent": "agents/test-automation-engineer.md"
    },
    {
      "name": "Risk Assessor",
      "focus": "Security, reliability, and operational risk identification",
      "agent": "agents/risk-assessor.md"
    },
    {
      "name": "Code Analyzer",
      "focus": "Static analysis for testability, quality metrics, coverage gaps",
      "agent": "agents/code-analyzer.md"
    },
    {
      "name": "TDD Coach",
      "focus": "Red-green-refactor guidance, test-first development practices",
      "agent": "agents/tdd-coach.md"
    }
  ],
  "enhances": [
    {
      "phase": "qe",
      "trigger": "crew:phase:started:success",
      "response": "qe:analysis:completed:success",
      "capabilities": [
        "test-strategy",
        "scenario-generation",
        "risk-assessment",
        "coverage-analysis"
      ]
    },
    {
      "phase": "build",
      "trigger": "crew:phase:started:success",
      "response": "qe:tests:generated:success",
      "capabilities": [
        "test-generation",
        "test-automation",
        "tdd-coaching"
      ]
    },
    {
      "phase": "review",
      "trigger": "crew:phase:started:success",
      "response": "qe:review:completed:success",
      "capabilities": [
        "test-quality-review",
        "coverage-review",
        "flakiness-detection"
      ]
    },
    {
      "phase": "*",
      "trigger": "qe:analysis:needed:success",
      "response": "qe:analysis:completed:success",
      "capabilities": [
        "shift-left-review",
        "quality-gates"
      ]
    }
  ],
  "hooks": {
    "subscribes": [
      "crew:phase:started:success",
      "qe:analysis:needed:success"
    ],
    "publishes": [
      "qe:analysis:completed:success",
      "qe:tests:generated:success",
      "qe:review:completed:success",
      "qe:tdd:cycle:completed:success"
    ]
  },
  "skills": [
    {
      "name": "qe",
      "command": "/wicked-qe:qe",
      "description": "Quality review across the full delivery lifecycle"
    },
    {
      "name": "qe-plan",
      "command": "/wicked-qe:qe-plan",
      "description": "Generate comprehensive test plan"
    },
    {
      "name": "qe-review",
      "command": "/wicked-qe:qe-review",
      "description": "Review test quality, coverage, and practices"
    },
    {
      "name": "scenarios",
      "command": "/wicked-qe:scenarios",
      "description": "Generate test scenarios with edge cases"
    },
    {
      "name": "automate",
      "command": "/wicked-qe:automate",
      "description": "Generate test code from scenarios"
    }
  ]
}
