{
  "specialist": {
    "name": "wicked-platform",
    "role": "devsecops",
    "description": "DevSecOps specialist for security scanning, CI/CD pipelines, infrastructure, compliance, and incident response."
  },
  "personas": [
    {
      "name": "Security Engineer",
      "focus": "Vulnerability assessment, OWASP compliance, secure coding, secrets management",
      "agent": "agents/security-engineer.md"
    },
    {
      "name": "DevOps Engineer",
      "focus": "CI/CD pipelines, GitHub Actions, deployment automation",
      "agent": "agents/devops-engineer.md"
    },
    {
      "name": "SRE",
      "focus": "System health, capacity planning, performance, reliability",
      "agent": "agents/sre.md"
    },
    {
      "name": "Incident Responder",
      "focus": "Rapid triage, root cause correlation, blast radius assessment",
      "agent": "agents/incident-responder.md"
    },
    {
      "name": "Compliance Officer",
      "focus": "SOC2, HIPAA, GDPR, PCI regulatory compliance",
      "agent": "agents/compliance-officer.md"
    }
  ],
  "enhances": [
    {
      "phase": "build",
      "trigger": "crew:phase:started:success",
      "response": "platform:security:scanned:success",
      "capabilities": [
        "security-scanning",
        "ci-cd-setup",
        "infrastructure-review",
        "deployment-automation"
      ]
    },
    {
      "phase": "review",
      "trigger": "crew:phase:started:success",
      "response": "platform:review:completed:success",
      "capabilities": [
        "security-review",
        "compliance-check",
        "deployment-review"
      ]
    },
    {
      "phase": "*",
      "trigger": "platform:incident:detected:success",
      "response": "platform:incident:resolved:success",
      "capabilities": [
        "incident-response",
        "health-assessment",
        "error-analysis"
      ]
    }
  ],
  "hooks": {
    "subscribes": [
      "crew:phase:started:success",
      "platform:incident:detected:success"
    ],
    "publishes": [
      "platform:security:scanned:success",
      "platform:review:completed:success",
      "platform:incident:resolved:success",
      "platform:health:assessed:success"
    ]
  },
  "skills": [
    {
      "name": "security",
      "command": "/wicked-platform:security",
      "description": "Security review and vulnerability assessment"
    },
    {
      "name": "actions",
      "command": "/wicked-platform:actions",
      "description": "GitHub Actions workflow generation"
    },
    {
      "name": "health",
      "command": "/wicked-platform:health",
      "description": "System health check and reliability assessment"
    },
    {
      "name": "compliance",
      "command": "/wicked-platform:compliance",
      "description": "Regulatory compliance check"
    },
    {
      "name": "incident",
      "command": "/wicked-platform:incident",
      "description": "Incident response and triage"
    }
  ]
}
