{
  "specialist": {
    "name": "wicked-data",
    "role": "data-engineering",
    "description": "Data engineering specialist providing expertise in pipeline design, data analysis, ML model guidance, and analytics architecture."
  },
  "personas": [
    {
      "name": "Data Engineer",
      "focus": "ETL pipelines, data quality, schema design, performance optimization",
      "agent": "agents/data-engineer.md"
    },
    {
      "name": "Data Analyst",
      "focus": "Data exploration, statistical analysis, visualization, insights generation",
      "agent": "agents/data-analyst.md"
    },
    {
      "name": "ML Engineer",
      "focus": "Model development, training pipelines, feature engineering, ML deployment",
      "agent": "agents/ml-engineer.md"
    },
    {
      "name": "Analytics Architect",
      "focus": "Data warehouse design, data modeling, lakehouse architecture, governance",
      "agent": "agents/analytics-architect.md"
    }
  ],
  "enhances": [
    {
      "phase": "design",
      "trigger": "crew:phase:started:success",
      "response": "data:architecture:reviewed:success",
      "capabilities": [
        "data-architecture-review",
        "pipeline-design",
        "schema-validation",
        "scalability-assessment"
      ]
    },
    {
      "phase": "build",
      "trigger": "crew:phase:started:success",
      "response": "data:quality:assessed:success",
      "capabilities": [
        "data-quality-checks",
        "pipeline-validation",
        "performance-review"
      ]
    },
    {
      "phase": "*",
      "trigger": "data:analysis:needed:success",
      "response": "data:analysis:completed:success",
      "capabilities": [
        "dataset-profiling",
        "exploratory-analysis",
        "insight-generation"
      ]
    }
  ],
  "hooks": {
    "subscribes": [
      "crew:phase:started:success",
      "data:analysis:needed:success"
    ],
    "publishes": [
      "data:analysis:completed:success",
      "data:pipeline:designed:success",
      "data:quality:assessed:success",
      "data:schema:validated:success",
      "data:model:reviewed:success",
      "data:architecture:reviewed:success"
    ]
  },
  "skills": [
    {
      "name": "data",
      "command": "/wicked-data:data",
      "description": "Core data engineering - profiling, quality checks, schema validation"
    },
    {
      "name": "pipeline",
      "command": "/wicked-data:pipeline",
      "description": "Pipeline design and review - ETL patterns, orchestration, performance"
    },
    {
      "name": "analysis",
      "command": "/wicked-data:analysis",
      "description": "Data analysis guidance - exploration, statistical analysis, insights"
    },
    {
      "name": "ml",
      "command": "/wicked-data:ml",
      "description": "ML model guidance - architecture, training, deployment, monitoring"
    }
  ]
}
